,attachmentKey,parentKey,parentTitle,linkTitle,url
141,YWM6CA27,2U8CSB72,From Munich to Pearl Harbor: Roosevelt's America and the Origins of the Second World War,Book review by Michael Warner,https://www.cia.gov/resources/csi/studies-in-intelligence/volume-46-no-3/from-munich-to-pearl-harbor-roosevelts-america-and-the-origins-of-the-second-world-war/
142,A4CPZN5Y,XNPTDTPG,God's Eye: Aerial Photography and the Katyn Forest Massacre,Book review by Benjamin B. Fischer,https://www.cia.gov/resources/csi/studies-in-intelligence/volume-46-no-3/gods-eye-aerial-photography-and-the-katyn-forest/
143,TD4E6R3V,SWZWMD3F,"Security Intelligence Services in New Democracies: The Czech Republic, Slovakia and Romania",Book review by John A. Wiant,https://www.cia.gov/resources/csi/studies-in-intelligence/volume-46-no-4/security-intelligence-services-in-new-democracies-the-czech-republic-slovakia-and-romania/
144,BPZ5WYN8,C2MVECFT,Cloak and Dollar: A History of American Secret Intelligence,Book review by David S. Robarge,https://www.cia.gov/resources/csi/studies-in-intelligence/volume-46-no-4/cloak-and-dollar-a-history-of-american-secret-intelligence/
145,X23T5GLS,PGIGYH3L,Spying on Spies How Elizebeth Smith Friedman Broke the Nazis' Secret Codes,Book review by Aaren Tucker,https://doi.org/10.1353/bcc.2024.a919499
146,GUHJHZUX,BQD4M4PU,Of Spies and Lies: A CIA Lie Detector Remembers Vietnam,Book review by Ward W. Warren,https://www.cia.gov/resources/csi/studies-in-intelligence/volume-47-no-1/of-spies-and-lies-a-cia-lie-detector-remembers-vietnam/
147,NT6KQ9IR,6GHLFKK7,Spy Capitalism: ITEK and the CIA,Book review by David S. Robarge,https://www.cia.gov/resources/csi/studies-in-intelligence/volume-47-no-1/spy-capitalism-itek-and-the-cia/
148,LTBXWTEQ,BTNNZ37P,Red Spy Queen: A Biography of Elizabeth Bentley,Book review by Michael Warner,https://www.cia.gov/resources/csi/studies-in-intelligence/volume-47-no-2/red-spy-queen-a-biography-of-elizabeth-bentley/
149,6RZXGTIH,VD3Y8G3W,A Look Over My Shoulder: A Life in the Central Intelligence Agency,Book review by Thomas M. Troy,https://www.cia.gov/resources/csi/studies-in-intelligence/volume-48-no-1/a-look-over-my-shoulder-a-life-in-the-central-intelligence-agency/
150,HJ36IH76,L4HDGRIY,Fixing Intelligence: For a More Secure America,Book review by Hayden B. Peake,https://www.cia.gov/resources/csi/studies-in-intelligence/volume-48-no-2/fixing-intelligence-for-a-more-secure-america/
151,E5SCZIX5,PLQKCDBF,Counterspy: Memoirs of a Counterintelligence Officer in World War II and the Cold War,Book review by Kevin C. Ruffner,https://www.cia.gov/resources/csi/studies-in-intelligence/volume-49-no-3/counterspy-memoirs-of-a-counterintelligence-officer-in-world-war-ii-and-the-cold-war/
152,ZFYUSWKQ,S6HNBKVA,First In: An Insider's Account of How the CIA Spearheaded the War on Terror in Afghanistan,Book review by J. Daniel Moore,https://www.cia.gov/resources/csi/studies-in-intelligence/volume-49-no-4/first-in-an-insiders-account-of-how-the-cia-spearheaded-the-war-on-terror-in-afghanistan/
153,V5VFL7YJ,947H59FR,"Thailand's Secret War: OSS, SOE and the Free Thai Underground during World War II",Book review by Troy J. Sacquety,https://www.cia.gov/resources/csi/studies-in-intelligence/volume-50-no-1/thailands-secret-war-the-free-thai-oss-and-soe-during-world-war-ii/
154,QZ2GV36T,7S6IFI34,At the Dragon's Gate: With the Oss in the Far East,Book review by Troy Sacquety,https://www.cia.gov/resources/csi/studies-in-intelligence/volume-50-no-2/at-the-dragons-gate-with-the-oss-in-the-far-east/
155,SEICZ4IA,9XWPUEKY,The Haunted Wood: Soviet Espionage in America—the Stalin Era,Book review by William Nolte,https://www.cia.gov/resources/csi/studies-in-intelligence/volume-50-no-2/the-haunted-wood-soviet-espionage-in-america-the-stalin-era/
156,BK8IT86R,6F5DKNDU,Uncertain Shield: The U.S. Intelligence System in the Throes of Reform,Book review by Stanley Moskowitz,https://www.cia.gov/resources/csi/studies-in-intelligence/volume-50-no-3/uncertain-shield-the-u-s-intelligence-system-in-the-throes-of-reform/
157,DXHK68IT,EBSF682B,In the Shadow of the Sphinx: A History of Army Counterintelligence,Book review by Michael J. Sulick,https://www.cia.gov/resources/csi/studies-in-intelligence/volume-50-no-4/in-the-shadow-of-the-sphinx-a-history-of-counterintelligence/
158,YZWN6FBR,B9J88W5R,"Special Agent, Vietnam: A Naval Intelligence Memoir",Book review by Michael Sulick,https://www.cia.gov/resources/csi/studies-in-intelligence/volume-51-no-2/special-agent-vietnam-a-naval-intelligence-memoir/
159,SEIWUSRI,2TW3TGT7,Spymistress: The True Story of the Greatest Female Secret Agent of World War II,Book review by Thomas F. Troy,https://www.cia.gov/resources/csi/studies-in-intelligence/volume-51-no-2/spymistress-the-life-of-vera-atkins-the-greatest-female-agent-in-world-war-ii/
160,NBZ2BM7I,Q6BXVLV5,Early Cold War Spies: The Espionage Trials that Shaped American Politics,Book review by John Ehrman,https://www.cia.gov/resources/csi/studies-in-intelligence/volume-51-no-2/early-cold-war-spies-the-espionage-trials-that-shaped-american-politics/
161,TUKKAR8K,TU6HRPQB,Enemies of Intelligence: Knowledge and Power in American National Security,Book review by Nicholas Dujmovic,https://www.cia.gov/resources/csi/studies-in-intelligence/volume-51-no-4/enemies-of-intelligence-knowledge-and-power-in-american-national-security/
162,K6N7JRZ3,I4PZZ5PC,"Hostile Intent: U.S. Covert Operations in Chile, 1964–1974",Book review by Elaine Carey,https://doi.org/10.1017/S0022216X08004902
163,QK7A4FLZ,82WRD7WU,Spymaster: Dai Li and the Chinese Secret Service,Book review by Bob Bergin,https://www.cia.gov/resources/csi/studies-in-intelligence/volume-53-no-1/spymaster-dai-li-and-the-chinese-secret-service/
164,MBSP5XUL,JJQWVIYT,The CIA and the Culture of Failure: U.S. Intelligence from the End of the Cold War to the Invasion of Iraq,Book review by Roger Z. George,https://www.cia.gov/resources/csi/studies-in-intelligence/volume-53-no-1/the-cia-and-the-culture-of-failure-u-s-intelligence-from-the-end-of-the-cold-war-to-the-invasion-of-iraq/
165,G27YLUGB,3ML63JIE,"US Covert Operations and Cold War Strategy: Truman, Secret Warfare and the CIA, 1945-53",Book review by Nicholas Dujomovic,https://www.cia.gov/resources/csi/studies-in-intelligence/volume-54-no-1/u-s-covert-operations-and-cold-war-strategy-truman-secret-warfare-and-the-cia-1945-53/
166,MCXMK65F,ZM9NVENM,"Deciphering the Rising Sun: Navy and Marine Corps Codebreakers, Translators, and Interpreters in the Pacific War",Book review by Emil H. Levine,https://doi.org/10.1080/01611191003600596
167,QKT3XIQV,ZM9NVENM,"Deciphering the Rising Sun: Navy and Marine Corps Codebreakers, Translators, and Interpreters in the Pacific War",Book review by Jeffrey G. Barlow,https://doi.org/10.1093/jahist/97.2.558
168,BKCJ2FZ3,ZM9NVENM,"Deciphering the Rising Sun: Navy and Marine Corps Codebreakers, Translators, and Interpreters in the Pacific War",Book review by Stephen C. Mercado,https://www.cia.gov/resources/csi/studies-in-intelligence/volume-54-no-2/deciphering-the-rising-sun-navy-and-marine-corps-codebreakers-translators-and-interpreters-in-the-pacific-war/
169,8Z8H3ZHX,VL6N8XBE,Operation Hotel California: The Clandestine War Inside Iraq,Book review by Matt P.,https://www.cia.gov/resources/csi/studies-in-intelligence/volume-54-no-2/operation-hotel-california-the-clandestine-war-inside-iraq/
171,BH8BXS7R,4LQ7D6D2,"SIX: A HISTORY OF BRITAIN'S SECRET INTELLIGENCE SERVICE, Part 1: Murder and Mayhem 1909-1939",Book review by Hayden Peake,https://www.cia.gov/resources/csi/studies-in-intelligence/volume-54-no-4/six-a-history-of-britains-secret-intelligence-service-part-1-murder-and-mayhem-1909-1939/
173,6JVQRHV5,HSA3MXK3,Stalin's Romeo Spy: The Remarkable Rise and Fall of the KGB's Most Daring Operative,Book review by John Ehrman,https://www.cia.gov/resources/csi/studies-in-intelligence/volume-54-no-4/stalins-romeo-spy/
174,ZUCV9HFC,KG7HI4DE,The Triple Agent: The Al-Qaeda Mole who Infiltrated the CIA,Book review by Stephen J. Garber,https://www.cia.gov/resources/csi/studies-in-intelligence/volume-55-no-3/the-triple-agent-the-al-qaeda-mole-who-infiltrated-the-cia/
175,FAU9X3S8,9QINYQ7A,No More Secrets: Open Source Information and the Reshaping of U.S. Intelligence,Book review by Anthony Olcott,https://www.cia.gov/resources/csi/studies-in-intelligence/volume-56-no-1/no-more-secrets-open-source-information-and-the-reshaping-of-u-s-intelligence/
176,Y2P265I2,RGJVQ6HU,Castro's Secrets: The CIA and Cuba's Intelligence Machine,Book review by Thomas Coffey,https://www.cia.gov/resources/csi/studies-in-intelligence/volume-56-no-3/castros-secrets-the-cia-and-cubas-intelligence-machine/
177,SB6RFTHL,RGJVQ6HU,Castro's Secrets: The CIA and Cuba's Intelligence Machine,Book review by Richard Feinberg,https://www.foreignaffairs.com/reviews/capsule-review/2012-05-01/castros-secrets-cia-and-cubas-intelligence-machine
178,IY23RSYP,DY7366UT,Intelligence Analysis: Behavioral and Social Scientific Foundations,Book review by Jason U. Manosevitz,https://www.cia.gov/resources/csi/studies-in-intelligence/volume-56-no-4/three-recent-works-on-improving-intelligence-analysis-pdf-29-4kb/
179,DU77FF96,JUAFJNNG,Cases in Intelligence Analysis: Structured Analytic Techniques in Action,Book review by Jason U. Manosevitz,https://www.cia.gov/resources/csi/studies-in-intelligence/volume-56-no-4/three-recent-works-on-improving-intelligence-analysis-pdf-29-4kb/
180,KKS7W7PE,N6VINEIJ,Historical Dictionary of Signals Intelligence,Book review by Gary K.,https://www.cia.gov/resources/csi/studies-in-intelligence/volume-57-no-2/historical-dictionary-of-signals-intelligence/
181,9YKC383V,KIJQXJPR,"In Plain Sight: Felix A. Sommerfeld, Spymaster in Mexico, 1908 to 1914",Book review by Mark Benbow,https://www.cia.gov/resources/csi/studies-in-intelligence/volume-57-no-3/hiding-in-plain-sight-felix-a-sommerfeld-spymaster-in-mexico-1908-to-1914/
182,AP6BDIHR,39GZI99Y,Spying in America: Espionage from the Revolutionary War to the Dawn of the Cold War,Book review by Clayton Lauire,https://www.cia.gov/resources/csi/studies-in-intelligence/volume-57-no-4/american-spies-espionage-against-the-united-states-from-the-cold-war-to-the-present/
183,XUDLYKH6,4F3662IV,American Spies: Espionage against the United States from the Cold War to the Present,Book review by Clayton Lauire,https://www.cia.gov/resources/csi/studies-in-intelligence/volume-57-no-4/american-spies-espionage-against-the-united-states-from-the-cold-war-to-the-present/
184,IM2KPK54,QV6APQVH,Operation Paperclip: The Secret Intelligence Program that Brought Nazi Scientists to America,Book review by Jay Watkins,https://www.cia.gov/resources/csi/studies-in-intelligence/volume-58-no-3/operation-paperclip-the-secret-intelligence-program-to-bring-nazi-scientists-to-america-pdf-210-8kb/
185,E8TTGX6W,5ZIUEDFZ,Secrets and Leaks: The Dilemma of State Secrecy,Book review by Jason Manosevitz,https://www.cia.gov/resources/csi/studies-in-intelligence/volume-58-no-3/secrets-and-leaks-the-dilemma-of-state-secrecy-pdf-207-6kb/
186,H6677YX6,A5UDEWZ6,A Spy Among Friends,Book review by Thomas G. Coffey,https://www.cia.gov/resources/csi/studies-in-intelligence/volume-59-no-1/kim-philby-the-unknown-story-of-the-kgbs-master-spy/
187,DE8Y85Q6,8BAA5ERJ,Listening in : RAF electronic intelligence gathering since 1945,Book review by Gary K.,https://www.cia.gov/resources/csi/studies-in-intelligence/volume-59-no-2/listening-in-electronic-intelligence-gathering-since-1945/
188,R8VQREWX,CUF79HAI,Colonel House: A Biography of Woodrow Wilson's Silent Partner,Book review by Mark Benbow,https://www.cia.gov/resources/csi/studies-in-intelligence/volume-59-no-3/colonel-house-a-biography-of-woodrow-wilsons-silent-partner/
189,NBRZ6E9W,ENYZEYW3,Surveillance and Spies in the Civil War: Exposing Confederate Conspiracies in America’s Heartland,Book review by Clayton Lauire,https://www.cia.gov/resources/csi/studies-in-intelligence/volume-59-no-4/surveillance-and-spies-in-the-civil-war-exposing-confederate-conspiracies-in-americas-heartland/
190,DPZURDKN,XXGSJ5JH,"Spies, Patriots, and Traitors: American Intelligence in the Revolutionary War",Book review by David Robarge,https://www.cia.gov/resources/csi/studies-in-intelligence/volume-59-no-4/spies-patriots-and-traitors-american-intelligence-in-the-revolutionary-war/
191,DIL3XU3L,7TQE3IL9,The Great War of Our Time: The CIA's Fight Against Terrorism--From al Qa'ida to ISIS,Book review by Hayden Peake,https://www.cia.gov/resources/csi/studies-in-intelligence/volume-59-no-4/the-great-war-of-our-time-the-cias-fight-against-terrorism-from-al-qaida-to-isis/
192,IAQM3U3L,9W6UWHGY,"Avenue of Spies: A True Story of Terror, Espionage, and One American Family’s Heroic Resistance in Nazi-Occupied Paris",Book review by David Foy,https://www.cia.gov/resources/csi/studies-in-intelligence/volume-60-no-2/avenue-of-spies-a-true-story-of-terror-espionage-and-one-american-familys-heroic-resistance-in-nazi-occupied-paris/
193,WWAIZSER,E5AND6DJ,The President's Book of Secrets: The Untold Story of Intelligence Briefings to America's Presidents from Kennedy to Obama,Book review by Jason U. Manosevitz,https://www.cia.gov/resources/csi/studies-in-intelligence/volume-60-no-2/the-presidents-book-of-secrets-the-untold-story-of-intelligence-briefings-to-americas-presidents-from-kennedy-to-obama/
194,GMN6HX2Q,92WW9Q7V,"The Devil's Chessboard: Allen Dulles, the Cia, and the Rise of America's Secret Government",Book review by J. R. Seeger,https://www.cia.gov/resources/csi/studies-in-intelligence/volume-60-no-3/the-devils-chessboard-allen-dulles-the-cia-and-the-rise-of-americas-secret-government/
195,25LSM6SE,89UGSEYS,"When Should State Secrets Stay Secret?: Accountability, Democratic Governance, and Intelligence",Book review by Jason U. Manosevitz,https://www.cia.gov/resources/csi/studies-in-intelligence/volume-60-no-3/when-should-state-secrets-stay-secret-accountability-democratic-governance-and-intelligence/
196,ZPP2CIKR,UQE74JQG,"The Bletchley Girls-War, Secrecy, Love, and Loss: The Women of Bletchley Park Tell Their Story",Book review by David A. Foy,https://www.cia.gov/resources/csi/studies-in-intelligence/volume-60-no-4/the-bletchley-girls-war-secrecy-love-and-loss-the-women-of-bletchley-park-tell-their-story/
197,P4YWTEN9,PA2KKE5W,Spies in the Congo: The Race for the Ore that Built the Atomic Bomb,Book review by David A. Foy,https://www.cia.gov/resources/csi/studies-in-intelligence/volume-60-no-4/spies-in-the-congo-americas-atomic-mission-in-world-war-ii/
198,BTFL8UKR,S8NEVVAX,The Angel: The Egyptian Spy Who Saved Israel: The Egyptian Spy Who Saved Israel,Book review by Thomas G. Coffey,https://www.cia.gov/resources/csi/studies-in-intelligence/volume-60-no-4/the-angel-the-egyptian-spy-who-saved-israel/
199,TMJVUQS6,P4GB5BZW,"MacArthur’s Spies: The Soldier, The Singer, and the Spymaster Who Defied the Japanese in World War II",Book review by David A. Foy,https://www.cia.gov/resources/csi/studies-in-intelligence/volume-61-no-4/macarthurs-spies-the-soldier-the-singer-and-the-spymaster-who-defied-the-japanese-in-world-war-ii/
200,L7KDA3DA,LMSF2XYA,Code Girls: The Untold Story of the American Women Code Breakers of World War II,Book review by Chris Christensen,https://doi.org/10.1080/01611194.2022.2105179
201,TXBW7SAF,LMSF2XYA,Code Girls: The Untold Story of the American Women Code Breakers of World War II,Book review by Chris Christensen,https://doi.org/10.1080/01611194.2022.2026838
202,BWATDUJV,LMSF2XYA,Code Girls: The Untold Story of the American Women Code Breakers of World War II,Book review by David A. Foy,https://www.cia.gov/resources/csi/studies-in-intelligence/volume-61-no-4/code-girls-the-untold-story-of-the-american-women-codebreakers-of-world-war-ii/
203,MYQ7STXC,DW5YTPUG,Intelligence Analysis: A Target-Centric Approach,Book review by John Sislin and Christopher Marshall,https://www.cia.gov/resources/csi/studies-in-intelligence/volume-61-no-4/intelligence-analysis-a-target-centric-approach/
204,EWASITBZ,98DWENSU,The Ghost: The Secret Life of CIA Spymaster James Jesus Angleton,Book review by David S. Robarge,https://www.cia.gov/resources/csi/studies-in-intelligence/volume-61-no-4/the-ghost-the-secret-life-of-cia-spymaster-james-jesus-angleton/
205,H8LLR34M,LC5LDHY2,A Great Place to Have a War: America in Laos and the Birth of a Military CIA,Book review by Thomas L. Ahern,https://www.cia.gov/resources/csi/studies-in-intelligence/volume-61-no-4/a-great-place-to-have-a-war-america-and-the-birth-of-a-military-cia/
206,CA467GYH,5G5Y2DS7,"Destination Casablanca: Exile, Espionage, and the Battle for North Africa in World War II",Book review by Clayton Lauire,https://www.cia.gov/resources/csi/studies-in-intelligence/volume-62-no-1/destination-casablanca-exile-espionage-and-the-battle-for-north-africa-in-world-war-ii/
207,3IVEEGVF,7YTRU52F,The London Cage: The Secret History of Britain's World War II Interrogation Centre,Book review by J. R. Seeger,https://www.cia.gov/resources/csi/studies-in-intelligence/volume-62-no-1/the-london-cage-the-secret-history-of-britains-wwii-interrogation-centre/
208,CY3RKGE3,UEFHGEBP,Hollywood’s Spies: The Undercover Surveillance of Nazis in Los Angeles,Book review by David A. Foy,https://www.cia.gov/resources/csi/studies-in-intelligence/volume-62-no-2/hitler-in-los-angeles-how-jews-foiled-plots-against-hollywood-and-america/
209,WN2QFBM5,UHFMC9RD,Lever of Power: Military Deception in China and the West,Book review by Arturo Muñoz,https://www.cia.gov/resources/csi/studies-in-intelligence/volume-62-no-3/lever-of-power-military-deception-in-china-and-the-west/
210,8S8J2J26,LFU6DIL8,"The Secret Twenties: British intelligence, the Russians and the Jazz Age",Book review by J. R. Seeger,https://www.cia.gov/resources/csi/studies-in-intelligence/volume-62-no-4/the-secret-twenties-british-intelligence-the-russians-and-the-jazz-age/
211,LZQC4HSC,HN9AQ2WH,Secret Operations of World War II,Book review by Alexander Stillwell,https://www.cia.gov/resources/csi/studies-in-intelligence/volume-63-no-1/secret-operations-of-world-war-ii/
212,UKIT72T7,TIYK3K5W,"Surprise, Kill, Vanish: The Secret History of CIA Paramilitary Armies, Operators, and Assassins",Book review by J. R. Seeger,https://www.cia.gov/resources/csi/studies-in-intelligence/volume-63-no-3/surprise-kill-vanish-the-secret-history-of-cia-paramilitary-armies-operators-and-assassins/
213,HZ9YX3D3,3IWC79TZ,Active Measures: The Secret History of Disinformation and Political Warfare,Book review by J. E. Leonardson,https://www.cia.gov/resources/csi/studies-in-intelligence/volume-64-no-1/active-measures-the-secret-history-of-disinformation-and-political-warfare/
214,N236S4LA,ICGUZ8YC,The Walls Have Ears: The Greatest Intelligence Operation of World War II,Book review by J. E. Leonardson,https://www.cia.gov/resources/csi/studies-in-intelligence/volume-64-no-2/the-walls-have-ears-the-greatest-intelligence-operation-of-world-war-ii/
215,VN3CRX3Q,NFG99BK6,Japan’s Spy at Pearl Harbor: Memoir of an Imperial Navy Secret Agent,Book review by Stephen C. Mercado,https://www.cia.gov/resources/csi/studies-in-intelligence/volume-64-no-2/japans-spy-at-pearl-harbor-memoir-of-an-imperial-navy-secret-agent/
216,37EUUSPJ,GLCNC4AP,"Secret Documents of Intelligence Branch on Father of The Nation, Bangladesh: Bangabandhu Sheikh Mujibur Rahman: Volume IV (1954-1957)",Book review by Ryan Shaffer,https://www.cia.gov/static/Secret-Documents-Pakistan.pdf
217,KXQP2LJL,3CSN27LI,"Secret Documents of Intelligence Branch on Father of The Nation, Bangladesh: Bangabandhu Sheikh Mujibur Rahman: Volume III (1953)",Book review by Ryan Shaffer,https://www.cia.gov/static/Secret-Documents-Pakistan.pdf
218,G95TMJAL,6GJWD73V,"Secret Documents of Intelligence Branch on Father of The Nation, Bangladesh: Bangabandhu Sheikh Mujibur Rahman: Volume II (1951-1952)",Book review by Ryan Shaffer,https://www.cia.gov/static/Secret-Documents-Pakistan.pdf
219,AK483WBB,9MPJ2A37,"Secret Documents of Intelligence Branch on Father of The Nation, Bangladesh: Bangabandhu Sheikh Mujibur Rahman: Volume I (1948-1950)",Book review by Ryan Shaffer,https://www.cia.gov/static/Secret-Documents-Pakistan.pdf
220,3SITFWUL,4PRC6NTD,Major General George H. Sharpe and The Creation of American Military Intelligence in the Civil War,Book review by David Welker,https://www.cia.gov/resources/csi/studies-in-intelligence/volume-64-no-4/major-general-george-h-sharpe-and-the-creation-of-american-military-intelligence-in-the-civil-war/
221,E6QB9CIG,NA429H6Y,Chinese Spies: From Chairman Mao to Xi Jinping,Book review by David Ian Chambers,https://www.cia.gov/resources/csi/studies-in-intelligence/volume-64-no-4/chinese-spies-from-chairman-mao-to-xi-jinping/
222,UY4JHUFZ,PAIMXUPK,Putin's People: How the KGB Took Back Russia and Then Took On the West,Book review by J. E. Leonardson,https://www.cia.gov/resources/csi/studies-in-intelligence/volume-64-no-4/two-new-contributions-to-putin-studies-putins-people-and-rigged/
223,XEY8WMVK,KHJY84CN,The Spy Masters: How the CIA Directors Shape History and the Future,Book review by Thomas Coffey,https://www.cia.gov/resources/csi/studies-in-intelligence/volume-65-no-1-march-2021/review-the-spy-masters-how-the-cia-directors-shape-history-and-the-future/
224,QNTZDJZE,NWS9389D,Geospatial Intelligence: Origins and Evolution,Book review by Joseph W. Caddell,https://www.cia.gov/resources/csi/studies-in-intelligence/volume-65-no-1-march-2021/review-geospatial-intelligence-origins-and-evolution-reviewed-by-joseph-w-caddell-jr/
225,P73P3PD5,AQY6J9ZZ,"The Nazi Spy Ring in America: Hitler's Agents, the FBI, and the Case That Stirred the Nation",Book review by Ralph Erskine,https://doi.org/10.1080/01611194.2021.1878308
226,TQ4LI4L4,AQY6J9ZZ,"The Nazi Spy Ring in America: Hitler's Agents, the FBI, and the Case That Stirred the Nation",Book review by David A. Welker,https://www.cia.gov/resources/csi/studies-in-intelligence/volume-65-no-2-june-2021/the-nazi-spy-ring-in-america-hitlers-agents-the-fbi-the-case-that-stirred-the-nation/
227,SUEX7RK3,9HKYEJG3,"War of Shadows: Codebreakers, Spies, and the Secret Struggle to Drive the Nazis from the Middle East",Book review by M. Geary,https://www.cia.gov/resources/csi/studies-in-intelligence/volume-65-no-2-june-2021/war-of-shadows-codebreakers-spies-and-the-secret-struggle-to-drive-the-nazis-from-the-middle-east/
228,Q2HYJPQM,NC8X3RUZ,Atomic Spy: The Dark Lives of Klaus Fuchs,Book review by Steven D.,https://www.cia.gov/resources/csi/studies-in-intelligence/volume-65-no-2-june-2021/atomic-spy-the-dark-lives-of-klaus-fuchs/
229,P8AVSPK4,K68ZZGRK,Operation Dragon: Inside the Kremlin's Secret War on America,Book review by Graham Alexander,https://www.cia.gov/resources/csi/studies-in-intelligence/volume-65-no-3-september-2021-special-issue/review-operation-dragon-inside-the-kremlins-secret-war-on-america/
230,KNN8KHFV,S9B7D98P,Dead Doubles: The Extraordinary Worldwide Hunt for one of the Cold War's mostt Notorious Spy Rings,Book review by Graham Alexander,https://www.cia.gov/resources/csi/studies-in-intelligence/volume-65-no-3-september-2021-special-issue/review-dead-doubles-the-extraordinary-worldwide-hunt-for-one-of-the-cold-wars-most-notorious-spy-rings/
231,Y6NJRFX5,Q5DKJT3Q,Sleeper Agent: The Atomic Spy in America Who Got Away,Book review J. E. Leonardson,https://www.cia.gov/resources/csi/studies-in-intelligence/volume-65-no-4-december-2021/review-sleeper-agent-the-atomic-spy-in-america-who-got-away/
232,Y8TTYQWX,9R44MZVD,Clarity in Crisis: Leadership Lessons from the CIA,Book review by Mike R.,https://www.cia.gov/resources/csi/studies-in-intelligence/volume-65-no-4-december-2021/review-clarity-in-crisis-leadership-lessons-from-the-cia/
233,YRDUIL5L,QKMVV2CZ,First Casualty: The Untold Story of the CIA Mission to Avenge 9/11,Book review by Mike R.,https://www.cia.gov/resources/csi/studies-in-intelligence/volume-66-no-1-march-2022/review-first-casualty-the-untold-story-of-the-cia-mission-to-avenge-9-11/
234,BN79I6LI,M36S9KDW,Nazis on the Potomac: The Top-Secret Intelligence Operation that Helped Win World War II,Book review by Warren Fishbein,https://www.cia.gov/resources/csi/studies-in-intelligence/volume-66-no-2-june-2022/review-nazis-on-the-potomac-the-top-secret-intelligence-operation-that-helped-win-world-war-ii/
235,DRNJPGQL,ZB85JHJA,Spying from the Sky: At the Controls of US Cold War Aerial Intelligence,Book review by David A. Welker,https://www.cia.gov/resources/csi/studies-in-intelligence/volume-66-no-3-september-2022/review-spying-from-the-sky-at-the-controls-of-u-s-cold-war-aerial-intelligence/
236,YZLSZKK4,PWMCXUBL,A Drop of Treason: Philip Agee and His Exposure of the CIA,Book review by Brent Geary,https://www.cia.gov/resources/csi/studies-in-intelligence/volume-66-no-3-september-2022/review-a-drop-of-treason-philip-agee-and-his-exposure-of-the-cia/
237,XP2M23FJ,I6FRQFFB,"The First Counterspy: Larry Haas, Bell Aircraft, and the FBI's Attempt to Capture a Soviet Mole",Book review by David A. Walker,https://www.cia.gov/resources/csi/studies-in-intelligence/volume-66-no-4-december-2022/review-the-first-counterspy-larry-haas-bell-aircraft-and-the-fbis-attempt-to-capture-a-soviet-mole/
238,9VCP7RQC,P9CACXI7,The KGB and the Vatican: Secrets of the Mitrokhin Files,Book review by John C.,https://www.cia.gov/resources/csi/studies-in-intelligence/volume-66-no-4-december-2022/review-the-kgb-and-the-vatican-secrets-of-the-mitrokhin-files/
239,WRMIM5GV,CWGJFM8B,Capturing Eichmann: The Memoirs of a Mossad Spymaster,Book review by Ian B. Ericson,https://www.cia.gov/resources/csi/studies-in-intelligence/studies-in-intelligence-67-no-1-extracts-march-2023/review-capturing-eichmann-the-memoir-of-a-mossad-spymaster/
